poema,El año de cuatrocientos que noventa y dos corría,",
",el rey Chico de Granada perdió ,el ,"reino que tenía.
Salióse ",de ,la ciudad un lunes a mediodía,",
",cercado de caballeros la flor de ,la ,"Morería.
Su madre lleva consigo que ",la ,tiene compañía,".
",Por ese Genil abajo que el rey Chico se salía,",
",los estribos se han mojado ,que ,eran de gran valía,".
",Por mostrar más su dolor que en el corazón tenía,",
",ya que esa áspera Alpujarra era su jornada ,y ,"vía,
",desde ,una cuesta muy alta Granada se parecía,".
","Volvió a mirar a Granada, desta manera decía:
—¡",Oh,", Granada la famosa",", ","mi consuleo y alegría!
¡",Oh,", mi alto Albayzín y mi rica Alcaycería!
¡Oh mi Alhambra y Alijares y mezquita ",de ,"valía,
mis baños, huertas ",y ,"ríos, donde holgar me solía!
¿Quién os ha ",de ,mí apartado ,que ,"jamás yo vos vería?
Ahora te estoy mirando desde lejos, ciudad mía;
mas presto no te veré, pues ",ya ,"de ti me partía.
¡",Oh,", rueda de la fortuna, loco es quien en ti fía",",
","que ayer era rey famoso y hoy no tengo cosa mía!—.
Siempre ",el ,"triste corazón lloraba su cobardía,
y, estas palabras diciendo, ",de ,desmayo se caía,".
",Iba su madre delante ,con ,otra caballería,",
",viendo la gente parada ,la ,"reina se detenía
y ",la ,causa preguntaba porque ella no lo sabía,".
","Respondióle un moro viejo con honesta cortesía:
—Tu hijo mira Granada y la pena le afligía—.
Respondido había ",la ,"madre, desta manera decía:
—Bien es que como mujer llore con grande agonía
el que como caballero su estado no defendía—."
cancion_MiguelRíos_73,Oh… adiós amor,",
 ","adiós Granada.
 Oh… ",el ,"viento del sur
 me aleja ",de ,"casa.
 Y me rompe el corazón",",
 ",me atraviesa ,la ,"garganta
 y como al niño rey Boabdil
 ",la ,pena me mata,".
 ","Veo la Silla del Moro
 y la sierra que queda atrás",",
 ",veo la Alhambra ,que ,flotando se va,".
 ","En mis ojos se funde
 la imagen de mi ciudad",",
 ",roja ,y ,cálida ,desde ,la estación,".
 ",,Oh,… adiós amor,",
 ","adiós Granada.
 ",Oh,"… el viento del sur
 me aleja de casa.
 Y aunque sé que volveré
 harto ",de ,gloria ,y ,,de ,"frío
 también sé ",que ,"ya nunca seré
 Boabdil el chico
 porque aquí en este tren
 se endurecerá mi sino,
 voy tan tejos que al volver
 ",ya ,"no seré un niño.
 ",Oh,… adiós amor,",
 ","adiós Granada.
 Oh… ",el ,"viento del sur
 me aleja ",de ,casa,".
 ","En Atocha me bajé
 ",con ,un miedo africano,",
 ","boquiabierto en el andén,
 ",la ,pasta en ,la ,mano,".
 ",Y vagué por ,la ,"ciudad
 extasiado en el bullicio
 en un día frío y gris
 y Madrid me quiso."
