poema,"Nadie comprendía el perfume
de la oscura magnolia de tu vientre.
Nadie ",,"sabía que martirizabas
un colibrí de amor entre los dientes",,".
",Mil caballitos persas ,se ,"dormían
en la plaza con ",luna ,,de ,tu frente,",
",,mientras ,,que yo ,"enlazaba cuatro noches
tu cintura enemiga de la nieve",".
",Entre yeso ,y ,"jazmines, ",tu ,"mirada
era un pálido ramo ",de ,simientes,".
",Yo busqué ,para ,"darte por mi pecho
las letras ",de ,marfil ,que ,dicen “siempre,".
","Siempre, siempre”, jardín ",de ,"mi agonía,
",tu ,cuerpo fugitivo para siempre,",
","la sangre de tus venas en mi boca,
tu boca ya sin luz para mi muerte."
cancion_EnriqueMorente_148,"Nadie comprendía el perfume
 de la oscura magnolia de tu vientre.
 Nadie ","comprendía el perfume
 nadie ","sabía que martirizabas
 un colibrí de amor entre los dientes",",
 de la oscura magnolia de tu vientre",".
 ",Para ver que todo ,se ,"ha ido
 para ver los huecos y los vestidos
 dame tu guante de ","luna
 ",que dame tu otro guante ,de ,"hierba,
 amor mío.
 El brusco rumor del bosque,
 el cielo daba portazos",",
 ","el brusco rumor dеl bosque
 ",mientras ,"clamaban las luces
 por los altos corrеdores
 el cielo daba portazos.
 Salí
 delirando y dando voces
 a la calle yo salí
 y a todo el ",que yo ,"me encontraba
 le preguntaba por ti
 y nadie razón me daba",".
 ","Para ver que todo se ha ido
 para ver los huecos ",y ,"los vestidos
 dame ",tu ,"guante de luna
 que dame tu otro guante ",de ,"hierba,
 amor mío",".
 ","Para ver que todo se ha ido
 ",para ,"ver los huecos y los vestidos
 dame tu guante ",de ,"luna
 ",que ,"dame tu otro guante de hierba,
 amor mío",".
 ","Para ver que todo se ha ido
 para ver los huecos y los vestidos
 dame tu guante ",de ,"luna
 que dame ",tu ,otro guante de hierba,",
 ","amor mío.
 (Transcripción propia a partir del audio a falta de fuente escrita; la
                    puntuación y ortografía son estimadas)."
