poema,Tristes ,,"guerras
",,si no es amor la empresa,,".
Tristes",,. Tristes,,".
Tristes ",,"armas
",,si no son las palabras,,".
Tristes",,. Tristes,,".
Tristes ",,"hombres
",,si no mueren de amores,".
Tristes. Tristes."
cancion_PacoDamas_848,Tristes,", tristes ",guerras,", ",si no es amor la empresa,".
 Tristes, tristes armas, si no son las palabras",".
 Tristes",", tristes hombres, si no mueren de amores.
 El mar tiene sed y tiene
 sed de ser agua la tierra.
 Alarga la llama el odio
 y el amor cierra las puertas.
 Voces como lanzas vibran,
 voces como bayonetas.
 Bocas como puños vienen,
 puños como cascos llegan",".
 Tristes",", tristes guerras, si no es amor la empresa",".
 Tristes",", tristes ",armas,", ",si no son las palabras,".
 Tristes, tristes hombres, si no mueren de amores.
 La sangre enarbola el cuerpo,
 precipita la cabeza
 y busca un hueco, una herida
 por donde lanzarse afuera.
 La sangre recorre el mundo
 enjaulada, insatisfecha.
 Las flores se desvanecen
 devoradas por la hierba",".
 Tristes",", tristes guerras, si no es amor la empresa",".
 Tristes",", tristes armas, si no son las palabras",".
 Tristes",", tristes ",hombres,", ",si no mueren de amores,".
 (Transcripción propia a partir del poema y del audio de la canción, a falta de
                    fuente escrita; la puntuación y ortografía son estimadas)."
